like_count,COMMENTS,RATING,URATING,comment_count,created_time,bad_word_count
0,anurag soni nab samjha gaurav hamesha kyo bolta rehta hai,3,3,4,1,
0,ffariha sanoberhhexa scarlet2 all our bhenjies,3,3,1,1,
0,kruthi krishna not everyone though,3,3,0,1,
0,shan tanu tu yahee fanda apnaya thha na,3,3,1,1,
0,when expressed in right way yasss,3,3,0,1,
1,kitne aadmi thai pls tell pc i cant wait to watch quantico season 3 2 n 1,3,3,0,0,
3,beautiful lady,3,3,0,0,
1,cant wait for this one,3,3,0,0,
1,looking gorgeous,3,3,0,1,
2,wow all the best moment my love you priyankachopra i am waating your tv show quantico season 3 best of luck all team bye see you,3,2,0,1,
0,i learned that who doesnt look for you doesnt miss you and who doesnt miss you doesnt care for you that destiny determines who enters your life but you decide who stays that the truth hurts only once and a lie every time you remember it there are three things in life that leave and never return words time and opportunities therefore value whoever values you and dont treat as a priority whoever treats you as an option check out our page for some truly amazing content,3,4,0,1,
1,love u pc,3,2,0,1,
1,hello sister,3,3,0,0,
0,love u pc i am waiting this show,3,3,0,0,
12,pc is back as alex parrish in quantico but this time she's undercover,3,3,2,0,
3,i loved season 1 mo  hope season 3 will b th best,3,3,1,0,
5,this woman is beautiful like priyanka  but famous & lovely & and popular in america,3,3,2,0,
1,such a beautiful place and you have such an enchanting smile madame you are looking so happy always be happy and keep    smiling madame.,3,3,0,0,
1,sooo pretty i want to meet you as a fan,3,3,0,0,
1,your smile is so lovely lovely queen i love you so much lovely queen of bollywood,3,2,0,0,
2,hello priyanka how are you doing today,3,3,0,0,
2,when you smile meri heart beat fast ho jate hai,3,3,0,0,
1,many many thanks and good wishes for a bright future with the best career,3,3,0,1,
1,madam you are the super star in the word love you,3,3,0,0,
3,very beautiful picture my sweet star. from singer ranjeet singh nagar greater noida,3,3,0,0,
1,looking so beautiful  sweet smile stylish classy awesome ,3,3,0,0,
1,that is really great keep on going for the goal,3,3,0,1,
0,welcome great super lovely beauty celebritie very favourite liken,3,3,0,1,
0,i love u priyanka chopra from tanzania,3,3,0,1,
0,she is brilliant priyankachoprag,3,3,0,1,
0,and everything that you do you work really hard at it thats really great,3,3,0,1,
0,very very miss you my sweetheart love you forever sona,3,3,0,1,
0,best days of my life,3,3,0,0,
2,whoever posted this i love you,3,3,1,0,
1,well done film making club bits pilani,3,3,0,0,
0,aakash gupta ye dekh editing,3,3,0,0,
82,modi ji this is the first time india has attainted true independence since last 3 years under your leadership until now it was under congress party which had nothing to do with hindus in reality,3,3,5,0,
41,this man deserves atleast one more term to accomplish the vision for india let not the work that he has started be detailed it will take centuries to put it on rails again,3,3,6,0,
16,push on regardless against corruption abolish caste based reservations remove article 37 you are the best pm india has ever had we need you to be pm for a long time,3,3,2,0,
38,sir please support merit candidates not the caste i believe that you have the power to change this educational system,3,3,0,0,
18,mr modi if you want to do something for common people why petroleum products should not be covered under gst you have the absolute majority kindly do this need full,3,3,3,0,
18,jai hind  sir reservation needs to be worked on if we really want india to be developed country pls look in to the same  thanks for being pm of our country we are with you keep rocking,3,3,0,0,
32,purani pension bahal kro hm to ap ko ji jan se chahte h aur age bhi chahte rhenge ap to mera dream h love u modi ji,3,3,5,0,
12,good evening sir private sector employees are looking at you need some standards n employers regulations for the welfare of private sectors,3,3,0,1,
9,lot of hope on you sir we are really privileged to have u as our pm and we know only u can do and take us to next level and make us develop country and remove the gap between bharat and india,3,3,0,0,
11,then why dont you begin making a new india by giving  reservations only and only on economic basis because clearly i dont see anywhere that ppl hangout with others after checking their caste,3,3,0,0,
11,naman naman modi ji  god bless u n keep u safe n healthy to get success in ur mission  we are proud of ur devotion sacrifice n hard work for welfare of country great modi ji again naman,3,3,0,0,
5,dear modiji make rules against private school for minimum based fees all over india level like up government. please focus on this issue for the future of our children,3,3,0,0,
5,no match for modi ji he is one of the best pm india has ever had god bless him so as to enable him to fulfill his dream of making india self sufficient and corruption free,3,3,0,0,
10,hindustan ke log hindustan se hi gaddari karte hai kha pee ke upwas karna bhagwan se to daro insaan jhut  kyu bolta haijhut se mujhe nafrat hai great pm modi ji zindabad jai hind,3,3,0,0,
5,honble prime minister sir we are always with you for uplift of our nation in all respect in this connection if any object that only basing on jealous later therewill be a spontaneous repent from the jealousies,3,3,0,0,
9,pls do some thing about private school fees as parents r facing great difficulties of paying it nd aam aadmi ki roz marra ki vastuon k rates pr bhi pls dhayn dijiyega honble pm ji,3,3,0,0,
9,reservations at education level should be removed those who cant afford education should be financially helped but no reservations,3,3,0,0,
6,please stop caste based reservation  we can look into supporting the economically backward but caste based reservation will not bring in competition and sustainable overall development of india,3,3,0,0,
5,sir there are very less job for dentist in government sector please see to it that it is increased and definetly goes topeople who are eligeble candidate not based on caste system,3,3,0,1,
4,he's not only the best pm but he is also the best human being and if anyone is a good being he/she can be a great leader modiji,3,3,0,1,
16,nice modi sir you are an inspiration for us lots of love,3,3,0,1,
1,sir like us imposed sugar tax on coldrinks and other food items  they have 12 sugar in 100 ml please sir take bold decision in this  our future generation have several health risk due to this slow poison white sugar  narendra modi,3,3,2,1,
5,best pm modi ji i have seen in my 66yrs of life u are dry honest hardworking dedicated and always thinking for the betterment of india i salute u sir jai hind jai bharat,3,3,0,1,
0,rip zunni you have my condolences sophie,3,3,0,0,
0,sorry wolf dogs are probably the best animals,3,3,0,0,
0,didnt know george could control the real world deaths,3,3,0,0,
0,such a beautiful dog,3,3,0,0,
0,xo,3,3,0,0,
0,so sad,3,3,0,1,
0,most non deserving character,3,3,3,1,
3,verified by littlefinger,3,3,1,0,
1,more like overall absence skipping a year,3,3,1,0,
25,the only one needing a bit of social presence is poor tormund how long are you making the poor fellow wait for his big woman,3,3,1,0,
10,2019 hbo you wrong for that,3,3,6,0,
6,consider it done valar morghulis,3,3,2,1,
1,why only a gif,3,3,2,0,
3,hurry up already,3,3,2,0,
0,hope books do not follow the show sequences,3,3,1,1,
1,go home hbo you are drunk,3,3,0,1,
7,i love game of thrones,3,3,0,0,
1,i wrote the final season off just like the talks of deadwood wrap up too late for that,3,3,0,0,
0,9 out of 10 social justice warriors agree,3,3,0,0,
1,just get to work and get the final season finished and on tv already,3,3,0,0,
0,is there a new episode this year,3,3,0,1,
340,i dont think those two things share a lot of the same audience,3,3,91,0,
247,nice try but you cant trick me in to thinking baseball is interesting,3,3,19,0,
2,im not a huge fan of baseball but if this is the only way i can get my got fix for the next year ill take it,2,3,1,0,
308,i almost jumped of my building thinking that you posted the fucking trailer bruh,3,3,19,1,
187,king robert would make a great umpire seven hells throw the bloody ball before i piss myself,3,3,20,1,
0,not even combining one of the most entertaining shows on tv can make me watch a full and slow season of baseball how do these two go together baseballs not brutal in the slightest sense of the word,3,3,1,1,
88,the season is long and full of terrors,2,3,5,1,
52,i watch this kind of shit to get away from sports ya dip shit,3,3,14,0,
29,i get chills listening to this music i cant believe we have to wait until 2019 for the last season of game of thrones,3,3,8,0,
13,spoiler during the seventh inning stretch they play rains of castamere and you get hit in the back of the head with a bat,3,3,1,0,
10,last year syndergaard played in a episode this year tormund giantsbane should play a game against the giants obviously as a stand in for justin turner,3,3,3,1,
4,mlb not paying minor league players who have a family more than minimum  wage lets talk about that game of cons,3,3,6,1,
1,idgaf about baseball im more curious as to the last season of got oh wait its not coming until next year,3,3,1,0,
20,dont do that it ruins it game of thrones you got me all excited i thought you had something to show us for season 8,3,3,5,1,
3,awesome went to the got night that the orioles had last year my friends & i had a blast highlight for me was having my photo taken on the iron throne loved the gotos shirt i got but hoping for a bobblehead this time but better believe ill be there for round 2,3,3,2,1,
2,who is playing with white walkers  if someone catches a home run ball can he or she ride a dragon lmao,3,3,1,1,
0,radha swami ji,3,3,0,0,
1,wish i could get part of roadies,2,3,1,1,
2,all chutya roadies ko congratulations  chutya kis leya q ke sharan ko nai leya jo deserve kar ta tha,3,2,0,0,
1,roadies winner jhak maarte hain aur show pe aake apni watt lagate hain super bakwaas,3,3,0,0,
1, all roadies ko congratulationsl,3,3,0,0,
0,this guy nikav got selected in roadies because he was working in viacom 18 and on coming saturday i will be coming live on facebook exposing nikav with proof,3,3,0,0,
1,congratulation all selected roadies,3,3,0,0,
1,congatulatolions for to journy,3,3,0,0,
1,congratulations,3,3,0,0,
0,i had not select but i will try next time,3,3,0,1,
0,congratulations roadies,3,3,0,0,
0,o bhai reeeee,3,3,0,0,
0,sharan ko nahi liya show ko aur neeche karavaaya,3,3,0,0,
0,love u rodies,3,3,0,1,
0,hiiiiiiiiii,3,3,0,1,
1,oye jyada bakwaas na kariyo,3,2,0,1,
0,my already frvrt one this season she is unbelievable,3,3,0,1,
1,nic girl but sharn ko nahi liya they all scripted,3,3,0,0,
1,she really deserve,3,3,0,0,
1,she is awsm,3,3,0,0,
0,respect,3,3,0,1,
0,wow,3,3,0,0,
0,love u,3,3,0,0,
0,dolly deserve to be here,3,3,0,0,
2,sayyed zadi priyank k bad mera fav on roadies ,3,3,4,0,
0,soo  cute,3,3,0,0,
0,i m proud of you northeast  boy vivekbora allthebest man,3,3,0,0,
0,ache paise mile hai isse bengali v sikh li ipl ke liye,3,3,0,0,
0,ab reached india or not,3,3,0,1,
0,i like kolkata knight riders,3,3,0,1,
0,bindass bijon ab positive,3,3,0,0,
0,2016 n 2017 watching other teams position,3,3,0,1,
0,2016 2017 match fixing,3,3,0,1,
0,anmol trehan this mean s,3,3,0,0,
0,this boy hav more international lovers fans  i like it also i hope one day i see you in newzealand to talk with you and take a lovely silfie,3,3,0,0,
2,a1 bowler h rashid khan,3,3,0,0,
0,i like this,3,3,0,0,
0,rashid khan is best,3,3,0,0,
0,i m waiting for bakricod terrorist,2,2,0,0,
0,hahaha,3,3,0,0,
0,he is the best,3,3,0,0,
0,yes lik,3,3,0,0,
0,hi,3,3,0,0,
0,shakib 40232,3,3,0,0,
0,best fielder,3,3,0,0,
0,the best fielder,3,3,0,0,
0,bravo champrash,3,3,0,0,
0,good luck srh,3,3,0,0,
0,no one care about bangladesh players lolz,3,2,1,0,
2,where is crowd,3,3,3,0,
0,another day another flop crowd in ipl 🇮🇳🇮🇳 half of the stadium is empty,3,2,5,0,
0,surprising land with full of terrorists but no medal in shooting pakistan sorry terroristan,2,1,0,0,
7,from banglasesh,3,3,0,0,
0,what is sarcasm answer pakistan is a free country thats sarcasm pakistan do not support terrorism thats sarcasm  psl isa league thats sarcasm and not to forget pakistane hav only one father thats sarcasm,2,2,0,0,
1,he forget beggardeshi player who remember,2,3,0,0,
1,srh win,3,3,0,0,
0,dear   ipl indian premier league  close pσωєяєd  by king toptk  king bot team,3,3,0,0,
0,imagine if he told names of all other 3 but just forgot the 4th person which is himself,3,2,0,0,
1,supporting rr today,3,3,0,0,
0,srh win,3,3,0,0,
0,good luck 4 rashid khan,3,3,0,0,
0,srh orange army will win sure,3,3,0,0,
0,plz link me,3,3,0,0,
0,rr have edge,3,3,0,0,
0,i am very disaapointed that delhi lost delhi has always been an average team,3,3,0,0,
0,good luck and have been working with a few weeks back to,3,3,0,0,
0,u people not get chance in rcb im feeling bad,3,3,0,0,
0,a big shut up on those people who say kkr is nothing in this season kkr hai tayar,3,3,0,1,
0,2 mints silence for those who told abd cant play again kuldeep and also chahal will be apart,3,3,0,1,
0,two min silence for the namde batch,3,3,0,1,
11,cheers to kkr but we all were expecting subman gill nagarkoti n tom curran in place of rinku vinay kumar n johnson,3,3,0,1,
1,ek trh psl jaha kutte bhi nai thukte haiaur dusri trh ipl jaha pure world ke best players india khelne aye haiburn pakistan,2,2,5,1,
3,100 strick rate ke nise bating korega,3,3,0,0,
1,kohli ne yeh match fix kiya hai,2,2,0,0,
3,sai nikhil bro i promised i will tag you in the best of the best,3,3,1,0,
0,yeah its an all women with prostrates edition,1,1,0,1,
0,ill take to pairs of glasss please in case one pair falls off,3,3,0,0,
0,he now has a pussy,2,2,0,1,
0,you can tell thats a fake fingers and nails very photo shopped photo shop fail!,3,3,1,1,
0,yeah you get it free purchase of 50,3,3,5,1,
1,your stuffs way to expensive especially the price for shipping,3,3,1,0,
0,ugh i wish i knew what shades to get im not a make up girl and wont purchase anything unless i know i like it cant decide w what to start w,3,3,1,0,
8,you still have 3 lives well done,3,3,2,1,
4,ladies and gentlemen were crashing and burning living and learning we are trying to do the write thing trying sighing soaring to a new highing were trying to prop up our position trying to improve our condition you see were trying to make it in this crazy world place become a positive player in the race gotta get your boots on and lace make a impression make a stand for what you believe be a busy bee dreamer and conceive peace have anger cease please and thank you,3,3,0,0,
0,wtf did i just watched it hurt my eyes and especially ears damn the sounds,3,3,1,0,
2,you are so hot,3,3,2,0,
0,kabhi bhi mere saath lasbian sex karna chaho to mujhe bulalena i am always ready to fuck with u,1,1,0,0,
0,sex at silent place how much rockin thought,2,1,0,0,
3,hi mia i am kamesh my age 22 i like your hot boobs plz i want it,1,1,0,1,
0,ooh your very sexy your boobs very big,1,1,0,1,
0,i love your nice big boobs 34dd and you so beautiful,1,1,0,0,
0,fk u day and night miss khalifa,1,1,0,1,
0,congrats,3,3,0,0,
0,it still hurts,3,3,0,0,
0,from waving hands to nothing haha k,3,3,0,0,
0,nidhi tayal i need to talk to you,3,3,0,0,
0,emily dutta cliche but whatever especially the teaching me part xd,3,3,3,0,
0,rahul pise hrushikesh patil thanks for making these years great for me you will be missed hope to see you soon,3,3,3,0,
0,so lucky to find u ppl in professional lyf didnt expect seriously shilpa sangita usha,3,3,3,0,
0,ankur pandey this is what i failed to learn last year nd kno now late though.,3,3,4,0,
0,swati bhargava i finally found u in my lifetime,3,3,1,0,
0,ajit singh keep them lucky you since you have them,3,3,1,1,
1,even those photos hurts a bit when people in them changes,3,3,0,0,
2,ushoshi majumdar this is such a nice thought,3,3,1,0,
1,wouldve bought you your favourite waffles midnight and learn your piano keyboards fav tune for you,3,3,1,0,
0,sir i found a common bug of fb pls consider about that and pls provide me the certain suggetions for submit this info to correct place authority of facebook,3,3,0,1,
0,how can i login with my id fb workplace,3,3,1,0,
0,airasia is a horrible company to use as a model. communication is horrible rude staff a company who only cares about profit and not abot customers,3,3,0,1,
0,nowadays we need to learn from some cheapo budget cost cutting company well done world,3,3,0,1,
1,connecting people and translating languages is great,3,3,0,1,
3,please i need a private message assistant i want steps to hide the show so no one can contact me because i have tried but it is a failure thanks all,3,3,0,1,
1,wondering how you join this place somebody please inbox i an access code please thanks in advance,3,3,0,0,
0,this is nice platform to communicate different people of different country,3,3,0,1,
0,good evening,3,3,0,0,
1,congratulations facebook,3,3,1,0,
0,i need to know the name of the speakers in this broadcast and where to contact them,3,3,0,1,
0,superb from vicki huff eckert from pwc! great partner for workplace by facebook,3,3,0,0,
2,thank for sharing,3,3,0,0,
0,why is facebook discriminating against the lower classes and spiritual people,3,3,0,1,
3,theyre alright this lot might go and see them,3,3,0,1,
0,a little bit of wee just came out,3,3,0,1,
0,jason has upgraded his tracksuit bottoms,3,3,0,1,
2,why are only 98 people watching this,3,3,0,1,
2,forced to engage in flirtatious conversation,3,3,0,1,
1,stuning and mindblowing the greatest live from far,3,3,0,0,
2,suzanne these are always so interesting to watch,3,3,1,0,
1,promising the people riches from the government in exchange for power. hmm where have i heard that before,3,3,0,0,
0,fantastic video summed up half of my sophomore year of world history in high school into a neat little 5min video great art direction and fun characters! bravo,3,3,0,0,
1,thanks teded the videos are interesting ways to learn,3,3,0,0,
0,i will never get tired of watching your videos,3,3,0,0,
0,love these history videos keep them coming,3,3,0,0,
0,everybody has a potential energy but he needs a healthy environment to be creative and innovative,3,3,0,0,
0,that attitude might not work in skydiving,3,3,0,0,
0,as often is the case a simplistic message of empowerment is very appealing delivered by an attractive speaker,3,3,0,0,
11,happy birthday and god bless you,3,3,0,0,
12,all song awesome by natural beauty maine kaha fulo se superb song &this song spls dedicated baho me chale a hamse sanam,3,3,0,0,
2,happy birthday and god bless you,3,3,1,0,
0,all song awesome by natural beauty maine kaha fulo se superb song &this song spls dedicated baho me chale a hamse sanam vikash govind singh hes shy this suitable song,3,3,0,0,
0,congratulations byju sir you were and always will be an inspiration for your students i can still recall your cat classes in manipal after 5 years,3,3,0,0,
0,congrats,3,3,0,0,
0,nice pic,3,3,0,0,
0,its not a just business its about our childrens future so thank you nd congrats all the best,3,3,0,0,
1,proud to be an byjus student,3,3,0,0,
1,proud to have such a fabulous and tremendous byjus visual learning platform in india,3,3,0,0,
1,absolute delight to hear srk speak on various forums and varied subjects with elegant ease audience love to hear his mind aloud and feel so good about it keep it up srk you are truly a marketing genius,3,3,0,0,
4,is a good message and is attractive to kids as srk id conveying the message,3,3,0,0,
1,visually anything is attractive and when you have srk who can articulate it in such a matter of fact and charming manner byju sure has a winner on their hands,3,3,1,1,
9,this is really very nyce app my kids are using it,3,3,0,0,
0,if srk speaks about i will look like madhuri dixit jokes apart their class room training was a real winner and my son was part of it,3,3,0,0,
6,its a better for the children who are under educataion,3,3,0,0,
1,audiovisual medium is a nice way to interact very easily playfully to teach without any stress on mind parents should be well aware of it,3,3,0,0,
2,anisha raina this is what i was telling you about,3,3,1,1,
0,best mag to children,3,3,0,0,
0,kartik charuvila you were asking a question hope you get your answer now,3,3,0,0,
0,saumya sahni okay byju is really big,3,3,0,0,
1,im too already love this apps,3,3,0,0,
1,my king rules the world,3,3,1,1,
1,mayb v didnt learn dis wy bt i wud recmnd it 2 my children evn evry children,3,3,1,1,
0,megha really,3,3,1,1,
0,wow fantastic,3,3,0,0,
1,happy children day and congratulations,3,3,0,0,
1,super,3,3,1,1,
0,im too already love this app,3,3,1,1,
2,wow thanks,3,3,0,0,
1,byju please do something for the students in the remote villages where internet facility had reached in some subsidized rates you know some teachers in rural areas are not having even basic knowledge of subjects as we have seen in national tv reports this could indeed be a revolution for those poor students can think of tying up with some multinational companies to chalk out the idea keep up the good work,3,3,0,0,
0,we offer incredible brand clothes and cosmetics products at shamasing prices check us out,3,3,0,0,
2,any opportunity for coordinator,3,3,1,1,
78,always love everything about,3,3,0,0,
0,sole of fashion world,3,3,0,0,
1,i think anything about wholesale is fab,3,3,1,1,
0,rules are made for women by men is a very strong statement but yes isn't it changing but i do applaud women who challenge the weave of society and cultures,3,3,0,0,
1,keep speaking your truth dear pankaja though i have met you only a few times i continue to be inspired by your vision and strength you are a rockstar,3,3,0,0,
0,beautiful and inspiring words proud of you di,3,3,1,1,
1,this is a great interview series amazing women with very inspiring views love it,3,3,0,0,
1,enjoy the shopping,3,3,0,0,
0,shahid,3,3,1,1,
0,http takeastep wooplr com,3,3,0,0,
0,bjp com,3,3,1,1,
0,i love future group,3,3,0,0,
0,can i join your group,3,3,0,0,
0,big hmm c,3,3,0,0,
0,when will it start,3,3,0,0,
0,sakshi gupta go for it,3,3,0,0,
0,anjali jha go baby go,3,3,0,0,
0,fbb keeps the worst collections may b dats y tollywood is nt developing,3,3,0,0,
0,price please,3,3,0,0,
0,onwer bilal satti catch me if you can latest fashion,3,3,1,1,
9,how many colours in this plz,3,3,1,1,
0,i want this,3,3,0,0,
0,lovely chlostes,3,3,0,0,
0,farzana sayyed arzoo navid pathan hahahahhahaha,3,3,0,0,
0,bakhtawar rajput it should be ur diet,3,3,1,1,
0,boobs,3,2,0,0,
0,you r so sexsi,3,2,0,0,
1,i went to phawk,3,2,0,0,
0,can i sleep next 2 u gal,2,2,0,0,
0,nyc ass gal mmmmm god bless,2,2,0,0,
0,"the only one way, that is the best way to have it",3,3,1,1,
0,ure loking nice,3,3,0,0,
0,jai hind jai bharat jai modi ji jai yogi ji,3,3,0,0,
1,jamaal hai issme suryavansham ka hira thakur bhi hai,3,3,0,0,
0,iske sath sath population control law bill loksabha m laye bjp admin plz reply,3,3,0,0,
0,he is good enough in oration like a perfect salesman.we experienced in our andhra pradesh issues.no surprise just beginning of the end.,3,3,0,0,
0,ha pappu se achha to modi hi hai,3,3,0,0,
0,abhi tak 70 saalon me congress ne desh ko loota hai,3,3,0,0,
1,jai hind,3,3,0,0,
0,slave mentality has not left indians prefer to be kicked by congress ka rani,3,3,0,0,
0,namo namo,3,3,0,0,
0,the facts are more laughable than kapils comedy.,3,3,0,0,
0,congratulations to everyone associated with the make in india revolution,3,3,1,1,
0,feeling proud,3,3,0,0,
0,good joke,3,3,1,1,
1,vicky heartfield omg the accuracy of this though,3,3,0,0,
0,sumbal iska to bio dekh k hi bus hogai thi,3,3,1,1,
0,shahzaib sarosh youll remain single af,3,3,1,1,
0,azka grammar mistakes suck,3,3,1,1,
0,landon hahahahahhahaha how i find those,3,3,0,0,
0,that explains why he never talks about me,3,3,0,0,
0,megan this is totally gonna happen to me,3,3,0,0,
0,i just think i found him now he wont even say hi,3,3,0,0,
1,shiv too real oof ouch,3,3,0,0,
0,kassie komeotis fucking a lol,3,3,0,0,
0,darnell bourassa theres me,3,3,0,0,
0,henal bhatt the embarrassment,3,3,0,0,
0,md safwan safa ex but you get the idea,3,3,0,0,
0,akash ill eat my rice and cheese from your salad too couple goals,3,3,0,0,
0,me if i had a bf,3,3,0,0,
0,theres no such thing as love once again in left alone tired of being lied to good luck to all those who are in love happy for you all,3,3,1,1,
0,newtons third law applicable here also,3,3,1,1,
0,so true,3,3,1,1,
0,the best love is the kind that awakens the soul that brings peace to our minds that’s what i hope to give you forever,3,3,0,0,
0,bryan dantoni what started as a tinder hook up ended up being the most incredible relationship ive ever been in,3,3,1,1,
1,i look at you and see the rest of my life in front of my eyes,3,3,0,0,
0,maybe because thats the first we develop each other,3,3,1,1,
0,carl smithwilkinson loved it when we started talking,3,3,1,1,
0,ashmita giri do u remember,3,3,1,1,
0,all everything that i understand i only understand because i love,3,3,0,0,
0,its a very dangerous state you are inclined to recklessness and kind of tune out the rest of your life,3,3,0,0,
0,always with you scotty,3,3,1,1,
0,fantastic,3,3,1,1,
0,the best and most beautiful things in this world cannot be seen or even heard but must be felt with the heart,3,3,0,0,
0,kusha nailed it completely,3,3,0,0,
