like_count,COMMENTS,RATING,URATING,comment_count,created_time,bad_word_count
0,extrembly irritating n so much pain in the head whenever u accidently see these post while scrolling down try to be creative atleast,3,3,0,0,
0,wtf did i just watched it hurt my eyes and especially ears damn the sounds,3,3,0,0,
3,hate being a troll you guys have major cred why are you ruining it with such videos if you dont have content take a break please,3,3,0,0,
1,ghosh kisi ko gussa bhi araha ho na yeah video dikha do bhai hassi apne ap ajegi badi sexo video hai,3,3,0,0,
0,sadly everyone is enjoying his downfall and if god forbid he takes the extreme step out of depression everyone will praise him,3,3,0,0,
0,his best like no other bt he need team to take off as same before,3,3,0,0,
0,best kapil sharma joke i heard ever the tweets & the recent recorded phone call with him yelling out slangs lit,3,3,0,0,
1,she is just dramatic,3,3,0,0,
0,love at first sight,3,3,0,0,
0,prettiest,3,3,0,0,
0,i love south delhi girls conversation keep it up it is never so boring very entertaining just amazing as you all are thank you please,3,3,0,0,
0,voted for only u guys,3,3,0,0,
0,love u girls u people r really awesome,3,3,0,0,
1,vote diya aur kya bas na,3,3,0,0,
1,all are not mental to take adhar,3,3,0,0,
1,the government is improving,3,3,0,0,
1,thank the adhar,3,3,0,0,
0,please do something fast,3,3,0,0,
0,badiya pranjal bhai aap misaal ho unke liye jo jaan bujhkr metro station pr gutka paan thukte h likha hone ke baawjood,3,3,1,1,
0,salute to that guy thanks mr pranjal dubey for caring our country,3,3,0,0,
0,tumhari ldka hokar utni fat gyi to tum kya khus rkhoge usko kha rhatha kya woldki ko rwana krdeta wo hath bhi nhi lga pata smjha bc,3,2,1,1,
0,bahut galat,3,3,1,1,
0,bro ye saale log kutte hote hain kutte,3,2,1,1,
1,aur aab tu uss ladki se pyar karta hai,3,3,1,0,
1,thts me,3,3,0,0,
0,sidak minocha start of our fraaaaandship,3,3,1,1,
0,shyam raikhere ab tu bhi barabri kar raha hai,3,3,1,1,
0,yeah too many indians out there lmao,3,3,0,0,
0,Ishika Goyal haath milao bhai tum.,3,3,1,1,
0,Anurag Ghode Vedant Lokhande mila kya koi hath milane ko,3,3,1,1,
0,Anupriya Pahwa kb ayega ye din,3,3,0,0,
0,The Naked Dance would've been better  literally it's better everywhere,1,3,0,0,
0,Maut or hawas ka nanga naach,2,2,0,0,
0,chutiye logo ko akkl bhi nhi hai br ambedkar ka face laga diya hai abe tumlog ki avkkat bhi nhi hai br ambekar naam bhi lene ki gaddro,2,1,0,0,
0,adwait best meme ever,3,3,1,1,
0,true af,3,3,1,1,
3,bhim ram rao ambedkar,3,3,1,1,
0,varenya penna shreya bahadure laughed so hard i almost passed out,3,3,0,0,
0,edittr jo bhi hai agar teko ek baap ne nikala rahega na samne aake mil,2,1,0,0,
1,she totally steped on his balls ankit verma,2,3,1,1,
0,utkarsh agrawal i hope youve seen sonu ke titu ki sweety,3,3,3,1,
0,hehe hillarious poor babu,3,3,0,0,
0,sushant awale kushagra singh arya much mature than sansa the dumbass,3,3,0,0,
0,yatish chandra shit that was so lame,3,3,0,0,
0,sareen read the comments too,3,3,0,0,
0,kitna jalo ge kitnaaaa jal jal k kaale hojao ge,3,3,0,0,
0,admin ko mai 10 marunga,2,2,0,0,
0,ashish kumar tera best friend ishq karke barbaad hua aur tu ye karkee hoga,3,3,0,0,
0,meethe hain ber dobara asa jhatu post dala to tri maa chodne me ni lgegi der,1,2,0,0,
0,yaar admin amit bhadana jaise 2 takke ki rhyming q kar rha hai,3,1,0,0,
0,garg sahb tatti,3,3,0,0,
0,"fir bhi is ke sath bethi hai, bad me feminist ban jayegi saare londo ko kosegi",3,3,0,0,
0,pakodi,3,3,0,0,
0,garvita jangra yrr ye kahan se cute lagti hai gavaar si to hai,3,3,0,0,
0,barsha katwal asu kalakheti tum logg,3,3,0,0,
0,ratna bose kya ye beautiful kya tu chutia agr baat etti si h ki ye ya tu to tu ratna ratna bose,3,3,0,0,
0,this could be us pr tu maanegi nhi divya sharma,3,3,0,0,
0,i dont compare my bestie with anyone because she is unique,3,3,0,0,
0,manoj namberdar option d ko taala laga do aur kabhi kholna mat,3,3,0,0,
0,princy tibrewal this is fucking shit,3,3,0,0,
0,lolz,3,3,0,0,
0,arnab banerjee aman srivastava tu dono kya chah rhe h pyaar se to maan nhi rhe ho,3,3,0,0,
1,soniya k sath kuch lafda tha kya kisi tym pe shadi me jarur ana typ ka,3,3,0,0,
0,who is ur crush,3,3,0,0,
0,abe darbok bokachhoda msg krna no. to de diye hum,2,2,0,0,
0,sirf no snd kr humko sala trace krke pakadke maarenge,3,2,0,0,
0,admin tera maa behnchhod,1,2,0,0,
0,abe madarchhod admin ka baccha,1,1,0,0,
0,randi ka ladka,1,1,0,0,
0,madarchhod hai kahan,1,1,0,0,
0,Behnchhod,1,1,0,0,
0,koi to roklo,3,3,0,0,
0,tera maa ka chut me ghusayengee admin ka maa ka chut me,1,1,0,0,
0,where is this gb road,3,2,0,0,
0,chander kunal bonus to bonus hi hota h chahe chhota ho ya bada,3,3,0,0,
0,wo first kaa baburao or last ka right wala pigal gaya tha..,3,3,0,0,
0,jitne sakht maa baap utne harami bachche ye bhi isi movie s pta chalta h ku rana sagar kehta ku ni...,3,3,0,0,
0,humaïra fuckerrrrrr,2,3,0,1,
0,this is the proof ki bhai ki bail hogyi,3,3,0,0,
0,black buck was driving that car,3,3,0,0,
0,for those wondering she gave him all the money she had in her pocket (most celebs don't carry a bunch of cash on them) she gave him 20 first then came back and gave him more,3,3,0,0,
0,i dont like her music but shes a pretty wholesome person,3,3,0,0,
0,vicky het beste detail hieraan is de hand die eruit ziet alsof die de roos weer terug gaat nemen,3,3,0,0,
11,my queen,3,3,0,0,
3,nathan kovacevic my heart,3,3,0,0,
0,mandy armitage luv her,3,3,0,0,
0,galiba hasin you smell,3,3,0,0,
0,someone got the pic of the dog without he meme please,3,3,0,0,
0,huyen ta i need that corgi in ma life,3,3,0,0,
0,meghan ong super cute,3,3,0,0,
1,henlo wurried fren. i am doin you a heckin hatter platter of joosey corgerines,3,3,0,0,
0,kaitlyn strong i hope that when you see me almost each and every day i can take all your worries your problems and your fears all away love you boo bear,3,3,0,0,
0,sanjutha i will help,3,3,0,0,
0,jade mutu me texting you goodnight i love you before bed knowing full well you not replying for 5 business days because i deliberately razzed you up before leaving,3,3,0,0,
0,i miss my mom every single day,3,3,3,1,
0,if mum texted me anytime now id lose my sanity,3,3,0,1,
1,i suffered from nearly crippling depression for two years after my youngest was born it affected me to the point that i was a completely different person and not just down and miserable i finally worked out the root cause completely by accident and the last three months ive caught myself almost in tears over little things that make my heart soar like making a meal i was sure my kids would hate but both of them ended up loving or reading a chapter in a book together with my oldest and just spending a few minutes hanging out before bed its always the little things that feel like the whole world,3,3,1,0,
1,during a really bad time last year i tried and failed to kill myself thankfully i remember so clearly the next day all the flowers in my neighbourhood bloomed early and i walked out and was surprised by the sight of gardens of bright tulips of every colour it smelled so amazing walking down the sidewalk i dont know if that day was warmer than the others that week but it felt like it now every spring i look forward to everything blooming,3,3,12,1,
0,its been a tough week but today i decided ot was my day.out for a bike ride in the pouring rain bliss,3,3,0,0,
1,no but im glad it exists and i hope you reading this finds it if you havent already good luck,3,3,0,1,
58,sabrina case this was literally me when we were sitting in my car about to go somewhere and its a great day to be alive came on and somehow you knew that song and i was just so amazed you knew my jam and we just kind of jammed but i keep basking in that moment and how free and lightweight it felt like most things i do with you do,3,3,1,1,
1,i sometimes fall in love when i am eating a good snack just kidding i always fall in love when eating a good snack,3,3,0,0,
10,i get this feeling sitting on the deck outside my house and watching the sky the leaves in the trees the animals in the ravine and the way the sun sets over the mountains usually while blasting fob but you love what you love i guess,3,3,0,1,
0,in the middle of a crazy day at the vets office holding a scared dog taking blood for tests shes going to be just fine hearing the kitten chirping as he waits for his shots the dog whining for attention in the back thats when i feel it before this year ive never felt that way before now i love coming home at the end of the day exhausted covered in god knows what needing a shower and food its honestly the dream,3,3,0,1,
3,natalie i felt this when we were at the beach with the doggos that one time and i was like oh i understand why she likes the beach so much now like it just hit me while i was standing there looking at and listening to the water,3,3,1,1,
0,not often enough its been a long time since ive had that kind of feeling,3,3,0,1,
3,i get this feeling at the most random times walking into a theme park and hearing the magical music playing walking home from work during sunset and watching the city skyline sat looking out of the window from my bed out at the lake sitting on the beach and running into the seaday to day life is so difficult and daunting but its these moments that make it worth it,3,3,0,0,
0,i really felt this like a week after my birthday when my two best friends surprised me ive literally never felt so happy as when im with them they make me love being alive lucky evans,3,3,2,1,
3,rebecca perkins anna wei honestly this is what i feel like whenever i get to hang out with you guys i love the moments where we fall into comfortable silence after talking aimlessly and endlessly about everything just us sitting together in the sun feeling the breeze on our skin enjoying the moment,3,3,1,1,
0,i havent feel that in a long time everytime my day seems like it will be a good day i always fucked up everything and feel like shit for the most part of the day sometimes i just want to scream but im to shy i hope one day o can feel that sensation again,3,3,0,0,
2,amber this reminds me of our art classes when wed get in trouble for talking laughing,3,3,2,1,
0,moments not really i love being alive 999 of the time god has blessed me beyond belief phillipians 16,3,3,0,0,
0,you will grow but only with sunlight and water. if your environment is toxic then youll never grow if youre in a bad situation do everything within your power and more to get out dont stay a seed bloom into a beautiful flower you can do it i believe in you,3,3,0,0,
0,you will grow unfotunately after graduation its mostly horizontally not vertical,3,3,2,1,
0,cant help but think of this guy and we all know how that turned out,3,3,1,0,
3,jordan thompson and ill watch you grow cus youre brilliant and im in awe of you,3,3,0,0,
2,that sounds more like nihilism than existentialism,3,3,14,0,
1,the first time i did lsd i totally broke down my grand delusion.the possibility of god gone hope for the future gone any external or universal sense meaning purpose or value attributed to anything or anyone gone my stress gone,3,3,5,0,
0,how can you exist on your own terms when you have control over absolutely nothing,3,3,5,0,
66,this isnt wholesome this is someone who thinks their life is a mistake,3,3,1,1,
86,in fact the galaxy doesnt see any actions as mess ups rather it views interactions as new forms of matter new data even if its data similar to previous data for its collective self it doesnt have a concept of good and bad everything comes and goes like the clouds in the sky,3,3,1,0,
5,but life on earth has taken billions of years to reach this point and it rests on each and every one of us not only to continue the species and i dont strictly mean breeding but contributing enough to ensure that others live on but to make life better for future generation in the history of the planet it is unprecedented for one species to have such control and responsibility not only of their own future but of the future of countless other species as well,3,3,2,0,
3,without the constraints of someone judging you for every action you know none of it matters and that its okay to make mistakes because those mistakes end not mattering but its a two way street so none of the good stuff matters either dark wholesomeness,3,3,3,0,
12,if you pay attention you realize that everything matters,3,3,1,0,
2,when existentialism becomes comforting rather than horrifying is literally sartres point in existentialism is a humanism,3,3,0,0,
4,the universe wont wait until you fail and laugh at you it just move on so should you,3,3,0,0,
3,yeah man thats how i live my life so im never stressed yo whatever happens happens and if my life gets really bad ill just kill myself,3,3,0,0,
23,jessica existentialism for the win,3,3,1,1,
2,elody geonn i assume you still have existential crises so maybe you can redirect that in a more positive way,3,3,1,1,
0,i mean thats part of the tenants of existential nihllism,3,3,0,1,
2,q what do comedians and diapers have in common a both should be changed regularly and both for the same reason,3,3,0,0,
1,by the way what does your wife tell her friends ever since you have left east india comedy,3,3,0,0,
1,tf,3,3,0,0,
1,good try,3,3,0,0,
0,pj,3,3,0,0,
0,my question is what exactly your mother in law is doing in your friend list,3,3,0,0,
0,by the way that sounds interesting,3,3,0,0,
1,meet up she may be assigning her property to you,3,3,0,0,
0,shweta shetty imagine facebook suggesting i meet my ex thanks but no thanks,3,3,0,0,
0,mil lo sir kharchi milegi,3,3,0,0,
0,something cooking,3,3,0,0,
0,well bhai can decrease the entropy of the universe,3,3,0,0,
0,thank god media didnt show the tissue paper used by the salman in the morning jail ka khaana aaj nikaal diya salman ne,3,3,0,0,
0,bhai buck buck band karo,3,3,0,0,
0,dekho raat me blackbuck samaj ke aapko na udaa de,3,3,0,0,
0,best pun ever,3,3,0,0,
2,wah wah,3,3,0,0,
0,how come no one ever appreciates sattu when biharis win or bullshit when sindhis do something nice oh i forget sindhis only do bullshit like your comedy,3,2,0,1,
0,the best marvel at ea on a get pa license for your help to make it work if they have to convince my house in this is an event in this is an event that the farewell matter da ipad for your email find to come up to you have received your help with all da ipad and i have to be there by 12 15 to ea plz assemble a saturday or concerns regarding my way back from tirupati,3,3,0,0,
0,csk players are not from tn m vijay & j narayan arent in first xi players,3,3,2,0,
1,theres nothing like north n south curd rice pani puri geographically it is said to be north n south but we all belong to same country we may have different cultures and languages but we all are same,3,3,0,0,
0,give me a rajma chawal poorie bhaji thali slurrp any day of course wash it down with a foot glass of chaach,3,3,0,0,
1,hi da iphone and android movies are added to the farewell to arms and legs and feet and was wondering if you have any questions or concerns please visit the plugin settings to determine how attachments are handled the situation and i will be there at the same with the group pa po to the farewell to arms and legs and feet and was wondering if you have any questions or concerns please visit the plugin settings to determine,3,3,0,0,
4,good marketing strategy before your chennai show if any,3,3,0,0,
0,remember pani puri aint gonna hold for long itll break and spill xd,3,3,0,0,
0,its not in curd rice atul khatri wherever curd is the same thing its in biriyani we eat possibly day by day hyderabadbiriyani biriyanilover,3,3,0,0,
0,curd rice is taken by 1 of the people boss pls understand geo,3,3,0,0,
1,no no youre wrong here csk won because man city fucked up,3,3,0,0,
1,yes instead of shilajit start eating this,2,3,0,0,
1,thats nothing some idiot found 450 on the street near tesco today he tried to give it to a police officer but the officer thought it was a prank and wouldnt accept it so this idiot bought himself a phone and groceries out of the store with the money this is where it gets hilarious the idiot kept tapping on see more,3,3,0,0,
1,wtf was that such a distateful statement when will u realise ur sense of comedy is rotten,3,3,0,0,
1,tamil nadu is a place of vivid culture,3,3,0,0,
0,i thought the first rule of dueling club was to never talk about dueling club,3,3,7,1,
1,even though harry despised snape snape in a way plays a role in harry learning important stuff like demonstrating expelliarmus which would become his signature move and writing useful info in the half blood prince potions book that helped harry get win ff and get slughorns memory,3,3,3,1,
2,can we just talk about how draco assumed a combative stance like obiwan,3,3,2,1,
74,second rule of dueling club scared potter,3,3,1,1,
3,serpensortia,3,3,2,1,
13,scared potter,3,3,1,1,
4,went arent thr any more harry potter weekends on tv,3,3,0,1,
5,i wonder if harry would have went on 1 12 instead of letting draco go on 2 instead of waiting for 3 what would have been said,3,3,0,0,
2,i love this scene you can see the camera man when draco falls,3,3,0,1,
2,the final and most important rule in dueling always try to stay alive,3,3,0,1,
0,lol jennifer hamm we should spar like this,3,3,1,1,
2,5 points to gryffinor for mr finnegans uncanny talent for pyrotechnics,3,3,0,1,
0,i think justin used bombarda or immflamara accidently but how may be wingardian leviosa can be upgraded to form a powerfull attack spell,3,3,0,0,
1,after the week ive had i really need another harry potter weekend to come on faithfully watch all films back to back no matter how many times ive seen them young harry was so innocent lol,3,3,0,0,
9,severus snape and actor by alan rickman the greatest of harry potter trilogy but he was a great man like wizards villains rip for alan rickman,3,3,2,1,
0,hogwartss old school many of great wizardes are there such as voldemort harry and friends,3,3,0,0,
2,"and three teenager thieves broke into both of them, when they were supposed to be in their seventh year",3,3,0,1,
10,love titanic great movie want a true love looking for a loving and caring man to spend the rest of my life with,3,3,1,0,
0,hands down the year titanic won was the best oscars show ever,3,3,2,1,
0,world best love story no more love story like titanic,3,3,2,0,
4,i always wished they were a couple but im glad that they remained close friends you rarely see that in hollywood.their friendship is so pure,3,3,3,1,
9,i watched that i was super excited every time titanic won best movie ever,3,3,1,1,
2,i live in the uk and i remember staying up all night to watch it was only 14 at the time too had school the next day lol,3,3,3,1,
6,the greatest emotional movie & awarded of all times the our hearts goes on,3,3,1,1,
2,and now with all the crappy movies and celebrities insisting on making everything into bashing trump no one cares any more,3,3,1,1,
10,nothing can ever compare to titanic kate and leo were pure magic on screen,3,3,1,1,
6,oh i remember 1998 i used to live in la back then and will never forget the hype about titanic,3,3,6,1,
3,the first and last oscars ive ever watched 90 of the nominated movies since then that were nominated i had never heard of,3,3,1,1,
7,thank you titanic lhave science has made i have his love and marriage and im lonely because of poverty i dont have love and marriage and im looking,3,2,1,1,
17,on 1999 i was see titanic and it is not able to lose from mind,3,3,0,0,
7,rose you are the most amazing and a sounding woman i ever had in to my life im too involved in your life now remember you jump i jump and promise me that you never leave me i promise you jack,3,3,2,1,
3,really titanic is the movie of celebrating valentine day its a real love story i have ever been seen,3,3,2,1,
0,love the film story n soundtracks they are beautiful when got video box collection it had the pictures n special piece of film in it beautiful,3,3,1,1,
23,"its staggering to see where this story has gone over the years from being an absolute disaster to something akin to fictional romantic overtones today thanks to a film that was on the whole as far from historical accuracy and truth as it is possible to get to get my drift the fundamental part of any titanic story is the mystery ship that stood by just a few miles away that did nothing why didnt cameron include this ship in his movie as the other 9 movies had done before not to include it is blatant whitewashing of all those on board whose hopes of being rescued were never going to be realised on that terrible night, unless as i expect there are legal issues surrounding the name of californian with serious ramifications",3,3,2,1,
3,happy valentines jack &rose i learned a lot from titanic tho the ending was nearer my god to thee,3,3,1,1,
6,something looks odd about his hands underneath her one of them doesnt even look like a real hand and the other one clasping the first seems to be at an odd angle that dicaprios own arm couldnt manage,3,3,3,1,
1,dreams & a nightmare some ppl died not enough lifeboats too much other stuff instead is it considered hoarding the gaudy stuff that was allowed instead of extra life boats,3,3,2,1,
5,one of movies on the top of my list of all time favouritesthank you to everyone that made it possible james cameron leo dicaprio kate winslet to name a few,3,3,0,1,
3,my favorite movie my late grandmother was supposed to be on titanic but the ship that was supposed to take her to titanic was in for repairs she didnt want to wait and came to america on another ship thank god she did,3,3,0,1,
5,the titanic was a monument to mans arrogance and class difference where the upper classes survived and the rest died in the sea or went down with the ship,3,3,0,1,
6,one of the best movie in hollywood james camron is a great director hollywood kate winslet and descripio acting skil superb,3,3,0,0,
5,ive watched this movie a hundred times and im always crying to death every time im watching it love u both jack and rose,3,3,0,1,
8,really wish that we could watch these on netflix or hulu,3,3,0,1,
2,they need to make this show into a movie,3,3,0,0,
2,i was reading it as salesman need to change my glasses,3,3,0,0,
5,62 and friendzoned with all qualities mentioned above girls want jerks,2,3,18,1,
1,pls dont say that if i get one id prpose on my knees,3,3,7,1,
0,actually there is an assamese rap song called washing powder nirma,3,3,1,1,
17,yeah edm is cool but you ever dance on teri aankhya ka yo kajal,3,3,3,1,
4,bhadwe search csk fixing and then mi fixing you will get to know the real thing logo me kya rakha hai mere paas hai picture tere g me dum hai tho enabke the photo comments i will upload,3,1,10,1,
2,sala mein abhi tak soch raha kon chutiya log iska video dekheke 5m 10m kardete he.bahut garb he apena upar iska aur overactiing baht karta he on the onther hand harse beniwal ashish round to hell carry ka isse kam subscriber he magar would log sap bahut ache acting and perferm karte he as compaied to amit,2,1,2,1,
3,were you alive when you posted it i mean how did you watch even 1 minute,3,2,1,1,
13,hum agar didi ka gand marenge to mera aur 1 bhai aajayega kyun hai naa tarun kumar rocky,1,1,1,1,
6,afsos wo paani me nhi hai chutad kahi ke,2,1,0,1,
6,neeraj kumar bulbule pooo gas k,2,1,0,0,
0,admin ki behen,3,2,0,1,
0,narend modi the best pm in india,3,3,0,0,
1,amit dilkush dhek lo apne congressio ko bc,3,1,0,0,
0,all leaders r fake its not only about rahul ghandi and other congress leaders,3,2,0,0,
0,thug life,3,3,0,0,
0,another embarrassment for the congress this fast will not take away the guilt of damage to property and deaths caused during dalit protest,3,3,0,0,
0,even a 1yr old kid can do that,3,3,0,1,
0,he is so great leaving his lunch one day for 130 billion people,3,3,0,1,
0,isse jyada fast to hum log to pet kharab ho jane ke bad karte hai,3,2,0,0,
1,the time has come that ed investigate how this violence was funded congress has stooped very low this time,3,3,0,1,
0,let congress pay the money ordinary public knows in community who is good and who is bad so congress will suffer in the end any support for gunde will backfire,3,2,0,0,
0,congress is doing all kind of circus to gain power but people of the nation have decided its bjp again,3,3,0,0,
1,what an incredible moment for the team and all indians tukde tukde jnu team pls see this and decide whether to live in india as a proud indian or to go to hell or pak,3,2,0,0,
0,proud of our sports persons proud to be indian vande matram,3,3,0,0,
0,fuck the tukde tukde gand jai hind bharat mata ki jai vande matram,2,3,0,0,
0,thankyou all for making us proud thanku from bottom of soul and heart,3,3,0,1,
3,what is the definition of courage anyway Pappu Isnot  it sufficient for u that Modi has a courage to rule over u for last 4 years and u have no courage to  face media without written answers as usually u do in yr speeches,3,3,0,0,
6,sir rg do you know the meaning of courage modi has shown it through many actions like Demonetisation GST etc  but you name one courageous decision other than emergency implementation done by your clan,3,3,0,0,
2,congress people r very very courageous  they killed 10000 innocent sikhs in 1984 with enormous courage hariom,3,3,0,0,
0,match by match of IPL will unfold a new fave of this oppurtunist people Who eat indian rupees and vomits poison,3,3,0,1,
0,such men should be kicked out from news channels and sports channels,3,3,0,1,
0,ise politics me entry karna hai,3,3,0,0,
0,shameless looters voted to to power by stupid voters can any one of the 3 netas justify their sourse of income rags to riches by looting the state exchequer,3,3,0,0,
