like_count,COMMENTS,RATING,URATING,comment_count,created_time,bad_word_count
33,i thought i was the only one I was so stressed out by eating my popcorn that i waited until the loud scenes to touch the bag i was more stressed by the eating noises than by the movie plot,3,3,3,1,
4,once i was in a theater watching a horror movie with my gf she was having popcorn and scary scene came i tried to cuddle her she slapped and she threw the tub on me people thought she got scared and i got saved from humiliation,1,3,4,1,
0,was the movie awesome though,2,3,0,2,
3,i prefer doing this while watching a horror movie,3,3,0,1,
0,patricia brittany emily nathan kim how would yous go with being in a quiet cinema Some of you talk during the movie,2,3,1,1,
0,people who eat popcorn during a movie are always the enemy i hate them so much,2,3,0,1,
0,so advanced alien animals have blade which can cut though steel or iron last scene when she shoots one has blood flowing when its dead but in all of its creation history does not have photorecepters wtf,1,3,0,1,
1,When Jim takes the game Jinx a little too far arrowroot powder organic for skinand no soda machines are around,3,3,0,1,
2,thank goodness i saw this early  spoilers and hype everywhere would have messed with my expectation ps  yes our popcorn ended up uneaten how could you eat when you even forgot to breathe,3,3,0,1,
0,Saw it with some friends in this weekend and oml my friend had some plastic wrap but my attention was at her chocolate bar more than the screen not because I wanted a chocolate bar but because I was so used to silence,2,3,0,1,
1,kenny we had to chew our snacks in sync with the sounds lol,3,3,1,1,
0,at last a place where bf n husbands can get some peace even when their spouses are nearby,3,3,0,1,
0,lol i watched the movie eating mine popcorn was better then the movie,3,3,0,1,
0,jake staples we should see this in the cheap theater for our anniversary with the gift card we got for christmas,3,3,0,1,
0,pipo paul when i had to take out a napkin to wipe my snot had to say sorry 5 times,3,3,0,1,
0,rebecca corven michelle spoelder me eating popcorn and then getting hiccups ,3,3,1,1,
0,see how scary it is Lets watch will be fun  oh oh oh we should take someone wholl cry easily too faustina wong,3,3,0,1,
0,jesse petronis we have to see this,3,3,1,1,
0,this is good for people who are being friendzoned,3,3,0,1,
0,we should all go watch it this weekend wendy maldonado josh garza,3,3,0,1,
0,julio campos navarro keep your crunchy as hell nachos out of the movie theater ,3,3,0,1,
0,nope there were kids crying and people laughing where i watched it sukhmeet kaur,3,3,0,1,
0,juan jonathan maria read the comments lol,3,3,0,1,
5,thank the lord that you had the idea to start a band mr tedder where would we be without onerepublic,3,3,0,1,
4,hold this line and you may possibly get me shelling out attention in the near future as well,3,3,0,1,
0,best songs fpr all the time thank you one republic,3,3,0,1,
0,i think he was born on a mushroom ,3,3,0,0,
1,i have a joke so i told god i hate attention He said oh yeah you have my job now,3,3,0,0,
0,their best decision ever,3,3,0,1,
1,hey ryan,3,3,0,0,
1,so cute ,3,3,0,0,
0,bring native 2 again,2,3,0,0,
0,this video is amazing,3,3,0,1,
0,so happy they became a band and a awesome one at that,3,3,0,1,
1,have it ,3,3,0,1,
0,im thrilled zack didnt say no,3,3,0,1,
0,i want to see more ,2,3,0,1,
0,do u have it in vhs or beta,3,3,0,1,
0,happy easter,3,3,0,1,
1,hee hee hee stuff happens outside of la lots lol,3,3,0,1,
1,have it ,3,3,0,1,
6,if you dont announce european tour dates Ill not buy anything,2,3,0,1,
1,wow that long sleeve is everything ,3,3,0,1,
0,yeah not necessarily too stale have contemplated this exact topic to some degree,3,3,0,1,
0,nice t shirts but what about a baseball cap as well ,3,3,0,0,
0,oh man what are yall doing to my wallet,3,3,0,1,
0,fiiiiiirst oneeeeee ,3,3,0,0,
1,bit sleaze dumped by bay lol,3,2,0,1,
1,very cool,3,3,0,0,
0,such bad designs,3,1,0,0,
0,i already have mine the black one,3,3,0,1,
0,love it,3,3,0,0,
0,where are european tour dates,3,3,0,1,
0,i like that,3,3,0,1,
0,i hope he loses methi and modi loses varanasi and then eventually both lose their lives and leave the country at peace,2,1,0,1,
0,bsnl bilkul bekar hi,3,3,0,1,
0,india me jab bhi koi Peace ki baat kerta hai bjp ko usme hamesha piece nazar aata hai,3,1,0,1,
0,it seems may be or might be or perhaps or probably he wants the place to be given to pakistan,3,2,1,1,
0,add Punjab too in this paece border,3,2,2,1,
0,after some pakistani supporters death only piece will return,1,1,0,1,
0,do u have any takers anywhere,2,3,0,1,
0,game started after phalistinens death and militant evacuation then started chemical attack,2,3,0,1,
0,the beginning of love is to let those we love be perfectly themselves and not to twist them to fit our own image otherwise we love only the reflection of ourselves we find in them,3,3,0,1,
0,it cannot be anyone accept us,3,3,0,1,
0,this could so easily escalate lol,3,3,0,1,
0,trying is different from doing and doing is different from doing at the peak from doing in right time too late the hero is played by machail cain and sean connary  see the video,3,3,0,1,
0,may be if adhar success to evm but bananas must be defeated by modiji is confirmed evm will not work,3,2,0,1,
1,when modi ji loses varanasi seat maa ganga will make india shining like bfr in reigns of congress n upa govt of the people  by the people n for the people,3,3,0,1,
2,ndtv has congress supporting people particular community has one place for solace lol congress is world famous in ndtv facebook page,3,3,0,1,
42,its a sad day for golf when a looser like reed can win the masters,3,3,51,1,
1,who cares tiger winni g would have brought golf back Should have rigged it like all the other sports bye bye golf ,3,3,7,1,
13,but but but i thought tiger was going to win what happened all you lose riding tigers jock can all pay up on your bets put your money where your mouth is your hero came up well short this weekend and wont ever win another tournament of note the rest of his sorry career,2,3,29,1,
3,i feel sorry for anyone that watches grass grow on a golf course hell the fat guy down the road can play golf why is it even on tv golf and bowling hobbies of for the unathletic,2,2,5,1,
32,i feel so sorry for rickie 8th time in top 5 never won,3,3,9,1,
3,do these guys just pound cases of beer after every round never seen such a bunch of pudgy beer guts playing an elite sport,2,3,12,1,
24,one for all the pudgy dad bods out there,2,3,3,1,
3,dont let this distract you from the fact that hector is going to be running 3 honda civics with spoon engines and on top of that he just went into harrys and he ordered 3 t66 turbos with nos and a motec exhaust,3,3,1,1,
13,most disappointing masters ever even the crowd on 18 cheered rory more than the drunk chea,3,3,1,1,
2,what happen to the great tiger woods he was favored to win hopefully this will be the end of that drug addict womanizer in the sport of kings good riddance,3,3,1,1,
7,lebron james is the greatest basketball player to ever exist on this planet mj can take the loonytunes title,3,3,12,1,
9,he are vary god raply these log need aisa jawab media was not see impartunt naws bekar ke enter into wayktigad life koi meri englash pe bolke dekh,2,1,2,0,
0,pura clip 10 min ka hai,3,3,4,0,
8,the journalist do these cheap tricks of making false rumours in the air thats what they for there livelyhood everyone knows it but kapil ko bhi sambhal ke bolna chahiye tha what is this line teri beti ke sath ye nahi bolna chahiye tha itz shamefull if it is real,3,3,1,1,
0,omg,3,3,1,0,
7,bhai koi kisi ki personal life ke beech mai ghusega to woh kya usko shabhashi dega hr insaam aisa hi krega jo kapil kar raha h nothing wrong in it,3,3,0,0,
5,bahut km gaaliya di agar mai uski jagah hota to sk ghante ki recording hoti r sirf gaaliya hoti aaj kal reporters kuch bhi lkhte hai kisi ko kuch bhi bana dete hai bc kabhi alien doodh peene dharti aata hai to kabhi 2012 me to ye bhn k button poori duniya ko khatm krne me lage the sahi baat hai agar kisi k baare me likhoge ki usko daud phone krta hai to uski to phategi r phategi to likne vaale ki bhi phategi,2,3,0,0,
0,This guy actually deserves this... sale cheapest media in the world kisi k bare me kuchh b likh dete h...But still that line... sir aapko to english b nhi aati...English teri........##@#@@@#$@😂😂😂😂😂😂😂😂,3,3,0,1,
0,Anyone will abuse on Cheap shots. Though some words were really bad. It's just that when someone is going through bad phase every one starts to pull the person off from success.,3,3,0,1,
4,nice work done by kapil sharma ye bikao saale news reporters k sath tik kiya,3,3,0,0,
0,fuck kapil sharma isko journalist ki maa aur beti k bare me kuch nahi bolna chahiye tha shame pathetic person,1,3,0,0,
0,ashwani singh sharma ji ka ladka not chill or bc eglish kharab ho bata di,3,3,0,1,
0,maa chuda le apni bsdk,1,2,0,0,
0,sahil Khan tu bhi apni gaand chaudi kr le bc,1,2,0,0,
0,bolo tara ra ra ,3,3,0,1,
0,jstar jerry yarr baby so gayi se kafi kuch yad ay gaya,3,3,0,1,
14,abe choice hmare pas bhi bht h or ek baat btao ye shades bhi to tum ladkiho ne bnwaye h ek mai to sbr hota nahi h kuch alag kuch alag krte krte bc nya hi color aa jata h market mai asi ye companies chutiya bnati rehti h or no make mai bhi ye wo abe no makeup ka mtlb ni pta kya apni gltiya chupane ko ye video bna di,3,3,18,0,
7,Matlab kucchhh bhiiii...Relationship m aanay k bad girls khud nahen nahatien...Na medicure na pedicure 😏 Aesa lagta hai janu nahen janwar pal liya ho 😂😂😂😂,3,3,7,0,
1,tum ladkiya ek pe to tikjaaya kro fir bolti ho saare londe ek jaise hote hai ones a wise man said  these hoes aint loyal,2,3,2,0,
0,ruby rose sry for that day baby m majak kra tha yrr aage s nhi krunga yaara promise you,3,3,0,0,
0,well i guess we would be the first one who are actually happy that sunday is over  maryam siddiqa,3,3,1,0,
0,akshay haha listen to the whole video,3,3,1,0,
0,sunday is over but desi daru and english wali shop is still open keep enjoying till 11 59 pm,3,3,0,0,
0,agar meh gusse ki beechme batane baith gayi ki meh gussa kyu hu toh character nahi break hojaega thats just what i always saayy sanya sidana niharika dimri abhilasha chakraborty bhai dekhoo,3,3,1,0,
0,hahaha leena sheth yaar tumhare mood ka koi middle ground nhi hai kya,3,3,0,0,
0,khamosh dastak ghuse k beech me kesy btaen ghusa q ha,3,3,0,1,
1,rakhi nagpal ethe v chutiya,2,3,1,1,
0,daniyal hussain sunly gusyy k bech n bolty ,2,3,8,0,
2,Yye teen pagal randiyan itni veli hai kya bol rahi hai inko khudko nahi pata ,2,2,0,0,
0,trueee trueee trueee  maher walker tell me phone m ghus kr krte kya ho sakht lounda  khudka kuch heni bs phocha marte he  do kpdo m free yar  hmare ps to pehle hi sb color hote h humko sochna pdta h bot mushkil hoti h mgr nhii inko kon smjhae jb bimar ho tb kuch nhi kajal na lgao tb dekho kya hua bimar ho schh btao ,3,3,0,0,
1,Srishti I missed u so much in the past videos.... U rock gal...,3,3,0,0,
4,i am single since birth par pucho kaise maine yeh bohut bohut relate kiya because mere almost har girlfriends raat ke 12 baje jab going to be ek din ka break up hone par phone karti hai tab yahi sab sunne ko milta hai aur agar maine waisa hi kuch break up wali ghatna ke pehle bolu ki bhai tu na use chod de sahi nahi hai wo tere liye to bolegi u dont know him dont talk in that way,3,3,1,0,
3,crime patrol ka banda aj dekho kya acting kiya hai and shristi played it once again,3,3,1,0,
0,omg omg omg omg thats awesome masterpiece designed for all of us absolutely loved that show ,3,3,0,0,
1,you r making fun of our aarti and hurting our sentiments thats not right way agr tumme dam hai to muslimo ki azan ki ton pe koi creativity krke dikhao pr aap log aisa karoge nahi kyoki tumhri fat jygi  humesha hinduo ki he bhgawano ke sath creativity karna so called seculers,2,2,15,1,
0, uffff boards all the very best its really hard to forget such memories especially that of board exams uffff why wasnt this at mine time Im regretting all the very best again to all the patients of this boards named disease,3,3,0,0,
1,delhi mei itna sex badh gaya hai jitna amrica mei nahi hai,2,3,0,0,
0,bakchodi ho rahi hai,1,3,0,1,
2,this is why dd news is better than any other news channel sometime i feels like journalists like arnaw g is senior to judge of supreme court of india,3,3,0,0,
15,look who is talking about right journalism who is the biggest pressititue of the country right now,3,3,0,0,
2,well i dont have a particular gang but most of the time i find myself hanging out with just boys around and actually they never consider me as a girl either,3,3,0,0,
0,dhairya kartikpyushromeo literally my childhood growing up with you all please tere friend se intro karwa de na,3,3,2,0,
6,this is so me na proud bro in gang atharva haralikar rajat s b ubale pranav sapkal  utkarsha pendhari tujha kai upyog naiye ithe but tp mahnun sahaj ch tag kelay so that u dont feel leftout ,3,2,10,1,
2,vaishnavi sukriti anjali jyoti everyone is a bro and abhimanyu when youre the only guy in the group  you be our sis ,3,3,0,0,
4,rohit sharma madarchod saale haan hu mein assi galia bhi deti hu aur laundo ke saath bhi rehti hu aur tu toh apna jigri yaar hai saale hahahah,2,2,15,0,
1,well i am angry upset n not talking to u but i had to tag u in this  vishal sultania  but agar toone ab kuch bakwaas kiya na ghar mei tent yudh hoga,3,3,2,1,
8,koi aur kare to rape aur husband kare to pleasure consent matters my dear friends well if you are not accepting this then you should go somewhere and bury your face in some shit,1,3,10,0,
0,bc aadmiyo ka mann kab nhi hota hai be why did you marry for men its certainly a license at least that's what they feel,2,2,0,1,
2,people are commenting on this video without seeing that first of all this anchor is making it sound casual and funny himself this is a sensitive topic and we need to change the mindset of ppl slowly with right education and awareness do u even know that even by law its so difficult almost impossible to prove marital rape in one case the husband can be actually be violent where as in many cases the wife might falsely accuse him u cant go in streets of india or any asian country and expect the majority of ppl to understand the gravity of this topic ,3,3,0,0,
2,seriously ghusa maar dunga aurat ko laye kyun phir shadi karke pathetic,3,2,0,0,
1,gaurav pande today only i studied kamla das who talked about the carnel desires of women in 60s and in 2018 the thinking of many males is still the same,3,3,1,0,
1,its a pity indian men with this kind of mentality aint going nowhere  im pretty sure these views and values of these individuals are passed on to the younger generation as well in terms of sanskar,3,3,0,0,
1,srishti dua dekh le maine toh phele he btaya tha yaha ki kitna bekar hai soch logo ki,3,3,0,0,
1,if she is not ok it is rape  how can it be pleasure  soch badhlo,3,3,0,0,
1,amrit daksh sanjeev atul vimal hitendra siddhart bhai gill sahab has a girlfriend he doesnt masturbate ,1,2,6,0,
2,shruthi deepika riya sushmitha lol these kids have got serious issues its time they meet our gynecology dept,2,3,3,0,
1,periods nahi hote tho koi bhi nahi hota bhaiya bus fb pe pads ke saath dp hi click karwana aata hai kya pata aadho ko nahi hai dis is where our education system can contribute we can abuse language lekin bhaiya discuss nahi karenge,3,3,0,0,
0,himanshi bhatia ye tu hi hai call bhi tab karegi jab ghar ke neeche hogi,3,1,1,0,
0,rashmi sandeep deepankar apne late night plan to alg level ki mauj ,3,3,3,0,
0,shruti shetgaonkar roonita naik this is what happens evry time ,3,2,5,0,
0,muskaan dhar pta nhi kab ayega vo din jab hum dono waffle khane jayenge,3,3,0,1,
0,mona saraswat tripda chaudhary sanghmitra sharma roz roz muh utha ke a jaate ho bhai misaal bano kuch log to bhai 90 attendence leke ghum rhe hai kyun mona,3,3,5,0,
0,aur is logic to bahut khoob samjha hai humari jjahanvi singh ne haina megha singh simran chahal,3,2,4,1,
0,deepanshu harhla dunia gavah h aajtk happy schl mein aapke naam ki misaalen dii jaati h ,3,3,1,1,
0,prashant kumar recording se dikkat h ya kaam khtm ho gya apka,3,3,2,0,
4,bhenchodo  band kro yeh cringy campaign ffs,1,3,0,0,
0,what the fuck is this,1,2,0,0,
0,ban ja koi meri rani chutia bana dunga,1,3,0,0,
0,fuck him and let him rit in hell,1,3,0,0,
2,i thought you guys couldnt get lower than buzzfeed in quality of humor and memes but you did it bravo,3,3,0,0,
1,all india bakchod  content writer behen shaant hoja fuck boy encounter common procedure hai to understand and learn who you are not supposed to date eventually or marry definitely chill kar depressed feel karri hu tumhaari posts padh padh ke,2,2,1,0,
0,Fuckboi o myy gawd so much scented candles and flowers lets make a bad and consummate dear,2,3,0,0,
1,stop finding reasons to prove which type of marriage is best each marriage is beautiful and it completely depends on the mindset of the person how he or she takes it if youll take everything positive you will be able to live positive life jhadu pocha to dono m karna hota h love marriage m bachogey nahi safai se,3,3,0,0,
1,arindam biswas we shud hv ,3,3,4,0,
2,that is exactly not true we cant judge any marriage,3,3,0,0,
0,every marriage is grt in its own stop posting such rubbish posts full of negativity,3,3,0,1,
0,you seems to be social aatanki,3,3,0,0,
0,parul arora i agree but afsos cant find one,3,3,1,0,
0,marriage and men all are same in this world so guys chill,3,3,0,1,
0,bilkul sahi,3,3,0,1,
0,friendship marriage ,3,3,0,0,
0,oh i agree,3,3,0,0,
0,riya singh nonsense reason,3,3,0,0,
0,monty singh,3,3,2,0,
0,mohammed ishaq,3,3,0,0,
0,nice,3,3,0,1,
0,wow  ansh dwivedi spandan bose,3,3,1,0,
0,u guys nailed it i cant even balance a writing pad of mine even after many trails,3,3,0,0,
0,shardul,3,3,0,0,
1,saikat ghosh arjo sen dude thiss,3,3,0,0,
2,himanshu nikhil lets focus more on techfests,3,3,0,0,
1,mech walon ki koi qadr hi nahin hai nehal jajal nikhil arora :(,3,3,0,0,
0,manish bista ajj motivate ho gya kya sir ki bato see,3,3,0,0,
1,well swimming with sharks and one my bite you crossing a busy road like a moron a car may hit you etc so you now just a hint,3,3,0,0,
0,that last clip tho there must be a super kamina friend involved in throwing the stone,2,3,0,0,
0,barb smith dana thompson foister you just never know and its just that fast,3,3,0,1,
1,abdullah hanani some were really close,3,3,0,0,
0,bravi Utile uso del riciclaggio,3,3,0,1,
0,hilarius,3,3,0,1,
0,mahad tingitilu and coas hector mugaga,3,3,0,0,
0,ronald sales olha o cara da moto,3,3,1,1,
0,thanks,3,3,0,1,
0,biditsha ghosh a bit of change for you,3,3,0,0,
0,charlene lea,3,3,0,1,
0,subrata sarma,3,3,0,0,
0,mukesh bishwakarma,3,3,0,1,
120,where are those plastic fans who were saying mourinho should go i am true manchester united fan and i trust any manager appointed by ed woodward in mourinho we trust glory glory man utd,3,3,31,0,
60,this guy needs to play please jose dont ruin him,3,3,22,0,
0,weve good team but our manager is psycho now ull see herrera benched and pogba with matic in next match  i dont see any reason to change 4-3-3 but our manager will do it pogba is the best player going forward  find system to play him herrera is really good brain and loves his jersey he must not be benched lingard is too much inconsistent  buy some right winger  and we ll fight for the title next season,3,3,2,0,
116,15 days ago united 2 chelsea 1 united 2 liverpool 1 united 3 city only big clubs united big club in the world mourinho best manager,3,3,8,0,
26,so happy with our performance van gaal and moyes cant do this,3,3,19,0,
2,are u guys sure it was Joses handwork or the players them selves just decided to change the tactics in the second half cuz according to pogbas comment he said they decided to cum out in the second half since they had nothing to lose already so am suspecting those players actually changed the tactics themselves and not mourinho,3,3,6,0,
4,the players just decided to ignore mourinho tactics in the second half and play higher up the field typical that egotistical mourinho is trying to take credit for it as if it was his master plan,3,3,12,1,
18,this heavyweight champion never score in a big game,3,3,11,0,
26,the first half chris smalling was as useful as a wet piece of paper the second half he woke up and played like a manchester united defender should play even scored the winner at the etihad no less in fact all the lads played like manchester united should play with grit and determination never giving up fighting to the end made my day ,3,3,1,0,
7,no credit to you jose but to the players themselves they have just proved that they refuse to be further destroyed by your poor manmanagement poor decisions poor coaching and game strategy etc etc i strongly believe you should leave before you completely de motivate and destroy these great players jose should consult with sir alex on how to build and develop a great football team,3,3,1,0,
31,in the last five weeks manchester city liverpool and chelsea have all fallen on mufc  sword jose aint got much to prove but to get the fa cup and and wipe the floor with arsenal once again,3,3,6,0,
10, great football jose simple move with great precision from your players keep their cool  to get the best results in the end congrats jose you are a great manager cheers ,3,3,2,0,
1,"It's a shame that some of the funs have guts to complain about Mourinho, do you know is history. Do you know why is called the special one. Let me briefly elaborate about this, Mourinho plays a unique game than most of the coaches, for a person who doesn't know him will complain about the tactics he uses, these mind you have won all trophies he participated in. Is experienced in his kind of game that is why it's hard to win him. Funs you have to remember where this guy found this team and now is trying to fix it, before complaining look at the players is having and compare them with the previous teams he had managed before you start complaining. If the bus is moving you forward why are you blaming the driver yet you're reaching your destination. We are not in a game of try and error, this business where the funs have its interests while also the club has to benefit. It's a matter of time because Mourinho is a tested and proved driver, so please just tighten your seat belts, stop shouting to the driver, is the one who knows the roads so he assembles the bus depending on the state of the road. This is for the good o passengers to avoid repeatable accidents. So please stop distracting the driver because it is hard to find one who can drive this kind of bus as he does.",3,2,0,1,
7,When the team lose some of the fans would blame mourinho to put all the fault on his players and when the team win he will take all the credit please pay attention on the boss says,3,3,1,0,
28,what a comeback city were sure of the victory but united showed character smells like mourinho spirit,3,3,0,0,
0,haters will be like they were lucky well in your face cause that could undoubtedly be the best comeback we have seen all season with manchester united breaking their own record for best comeback in this match the previous one was against crystal palace fc,3,3,0,0,
2,completely agree jose is a fantastic manager it really rattles me when fans say that the clubs in a rubbish state  no the fact is jose has brought success back to the club under moyes and lvg we were poor poor results poor performances jose has made us a force again,3,3,0,0,
17,all I know is jose mourhino is the best coach after sir alex ferguson i am not surprised his being called the special one,3,3,0,0,
17,"
the best happiness sane sterling b silva fernandinho nd kdb career goals against manutd 2 while paul pogba alone 2 against mancity pogbooom pls mourinho keep use him at attacking midfielder",3,3,0,0,
7,but two things are constant this season degea cant concede more than 2goals in a match man u cant lose if they score before you conclusion man u make come back but dont tolerate comeback,3,3,0,0,
1,ut what mourinho should be saying is credit to the boys because they believed they believed that if they ignored all the anti football bus parking nonsense ive been forcing them to play we could win so they came out for the 2nd half ignored everything ive ever told them and played the way they believed manchester united should play and they won in spite of mourinho not because of him,3,2,0,0,
1,i wonder if sir alex walked into the dressing room at halftime and took over for mourinho that is the only explanation for this massive turnaround,3,3,0,0,
8,now we have 6rsenal to destroy at ot a fa cup to console ourselfs this season and move on to next season,3,3,0,0,
2,it was fantastic bt stop that mentality of defending first coz u did the same at sevilla and we whre beaten try both pliz dffnd and attackng,3,3,0,0,
7,thats why guadiola had to whisper something to the frenchman he admired his performance man u is indeed red,3,3,0,0,
0,cursing,3,3,0,0,
0,vandanee ramani bhgwan seekh le,3,2,1,0,
0,subin sounds like you haha,3,3,0,1,
1,maham mohsin i need this kind of company help me dude,3,3,1,1,
0,universal this is universal punch,3,3,0,1,
2,anuj sonawane tushar tambat pinky thakur wasim sayed,3,2,2,1,
0,so is my crush does,3,2,0,1,
0,aishwarya kumar nikita rajeshwarkar fall off,3,3,2,1,
0,parth karia fo,2,1,4,1,
1,gaurav chawla thought of the day lesson for life,3,3,1,1,
0,lucky were already applying it  no,3,2,1,1,
0,mahak preet kaur you,3,3,3,1,
0,sachin singh tm sala dhere dhere sbko marr rha h,3,2,2,1,
0,vivek patel the truth has been spoken,3,3,1,1,
